{
  "app": "0.1.0",
  "kind": "outputs",
  "outputs": [
    {
      "colorRange": "full",
      "defaultStack": 1,
      "device": "display:37D8832A-2D66-02CA-B9F7-8F30A301B230",
      "format": {
        "height": 1080,
        "interlaced": false,
        "rate": { "den": 1, "num": 60 },
        "width": 1920
      },
      "genlock": null,
      "keyFillPartner": null,
      "keyMode": "shaped",
      "kind": "display",
      "label": "Main",
      "number": 1,
      "transitions": { "blackout": 3, "switch": 2 },
      "uuid": "0d7d0000-0000-4000-8000-000000000001"
    },
    {
      "colorRange": "limited",
      "defaultStack": 1,
      "device": "decklink:8f3a21c0",
      "format": {
        "height": 1080,
        "interlaced": true,
        "rate": { "den": 1001, "num": 30000 },
        "width": 1920
      },
      "genlock": "reference",
      "keyFillPartner": null,
      "keyMode": "shaped",
      "kind": "sdi",
      "label": "Program SDI",
      "number": 2,
      "transitions": { "blackout": 2, "switch": 1 },
      "uuid": "0d7d0000-0000-4000-8000-000000000002"
    }
  ],
  "schema": 1
}
